{
  "schema_version": "MONO_CI_B0_PSI_CASE_MANIFEST_V1",
  "study_id": "MONO_CI_B0_PSI_COMPARISON_V1",
  "manifest_status": "SOURCE_CASE_IDENTITIES_FROZEN_FOR_REVIEW",
  "measurement_status": "NOT_EXECUTED",
  "architecture_transition": {
    "before_state": "A0_3_GOVERNED_MODULE_GRAPH",
    "before_commit_sha": "26a9bb667da7d0938e38aca15d2bf29fd1de4829",
    "before_repository_tree_sha": "7b951421395f532ca403dab09d76902ff08a807d",
    "before_application_tree_sha": "b147b8961ea9e76c966663d4832e4c303581151a",
    "before_checkpoint_sha256": "5da4a7e1ed359ec8ea1e3288ab81edf32f0b71e2fec946b52a8d0d562dcf43c0",
    "after_state": "A0_4_REPORT_QUERY_PORT",
    "after_commit_sha": "d3101c0d3aa9b7b709253b6ec7518416f05f65b9",
    "after_repository_tree_sha": "2b436e0aaf09403ea516d73d20a466a122f86592",
    "after_application_tree_sha": "007196f68652bc13f6798805793ffdfae96f95f7",
    "after_checkpoint_sha256": "7b0b0c7a0c6ac782540466d283c42d7589b8aaeb4af7df62104faa01fd154e8e",
    "scientific_description": "Transition from explicitly governed inter-module dependencies to interaction through a public module query interface."
  },
  "bounded_engineering_controls": [
    "AC_PUBLIC_API",
    "AC_MODULE_GRAPH"
  ],
  "source_case_archive": {
    "path": "experiments/pilots/EVAL01_RAW_EVIDENCE_V1.zip",
    "sha256": "f6cd3c7180a0719c0f410f51acc9596b0843950d7650da7f7d2924716188c9bf",
    "case_catalog_path": "experiments/pilots/EVAL01_MUTATION_CATALOG_V1.json",
    "case_catalog_sha256": "0d4aeb1b49aa800a4618dbce79966de40dcd070f78dfd515eb100086acab04a8",
    "role": "PROVENANCE_ONLY_NOT_METHOD_INPUT"
  },
  "cases": [
    {
      "case_id": "CASE_01",
      "source_case_id": "clean_unchanged_dependencies",
      "case_role": "compliant_source_control",
      "source_commit_sha": "d3101c0d3aa9b7b709253b6ec7518416f05f65b9",
      "repository_tree_sha": "2b436e0aaf09403ea516d73d20a466a122f86592",
      "application_tree_sha": "007196f68652bc13f6798805793ffdfae96f95f7",
      "mutation_patch_sha256": "e3b0c44298fc1c149afbf4c8996fb92427ae41e4649b934ca495991b7852b855",
      "mutation_bundle_sha256": null,
      "source_parent_sha": null
    },
    {
      "case_id": "CASE_02",
      "source_case_id": "forbidden_private_cross_module_import",
      "case_role": "public_interface_violation",
      "source_commit_sha": "97ae3947991f58e346620583b53f4ee3646f22e7",
      "repository_tree_sha": "5e705b12fd9cf78fcea96434996f0c742e773e75",
      "application_tree_sha": "effc8bb1a60f99edafa433eb073ec76f8b75c342",
      "mutation_patch_sha256": "198b4a69a6ea857962402bcdbe2d31bdce8e1879ab7c876958057957b22f07c7",
      "mutation_bundle_sha256": "8b408772d0b1e67e6bd367b02642051923170f8600dce26c83adbe5c54a6db4e",
      "source_parent_sha": "d3101c0d3aa9b7b709253b6ec7518416f05f65b9"
    },
    {
      "case_id": "CASE_03",
      "source_case_id": "undeclared_capability_dependency",
      "case_role": "allowed_dependency_graph_violation",
      "source_commit_sha": "c97570fa789515808a5de5f187f0a7416e391f39",
      "repository_tree_sha": "987a3aec7d8083c08dc2523d044aae05275727e3",
      "application_tree_sha": "459fe2ccbee82fee8d86536fa57331f77870108e",
      "mutation_patch_sha256": "6afe545399386f0c495f7b96f3607d0f35a07371ba4b0bfc5bba5616afc6197b",
      "mutation_bundle_sha256": "dc95745a7716cfaf24dc71db9dab1863c424278bd75b6c912bab93a44ec66be5",
      "source_parent_sha": "d3101c0d3aa9b7b709253b6ec7518416f05f65b9"
    },
    {
      "case_id": "CASE_04",
      "source_case_id": "missing_expected_capability",
      "case_role": "incomplete_scope_uncertainty_control",
      "source_commit_sha": "0f93897b2d66fd9bc77ffdfad50b21b6a7b07a3d",
      "repository_tree_sha": "77b1948a7253f66a9a1b159a69d828124a4f9ab2",
      "application_tree_sha": "56fcba37a678697f4367bd42381e6d743696d48f",
      "mutation_patch_sha256": "b561182012d64e7622e20eef3578bcdb7d1a1c169373105f4f23af67011dd556",
      "mutation_bundle_sha256": "4666b1f4131807dc9b30c3a14a907f424370ed64e723e3e64018dc3b04570071",
      "source_parent_sha": "d3101c0d3aa9b7b709253b6ec7518416f05f65b9"
    }
  ],
  "case_boundary": {
    "cases_are_independent_architecture_transitions": false,
    "case_repeats_are_independent_architecture_transitions": false,
    "operation_reference": "NOT_ESTABLISHED",
    "governance_reference": "NOT_ESTABLISHED",
    "obligation_denominator": "INCOMPLETE",
    "all_cases_measured_by_b0_and_psi": false
  }
}
